{
 "title": "September–October 2026 developments",
 "asof": "October 28, 2026",
 "intro": "A dated record of what happened around frontier-AI law in the United States from September 2026 onward. It is wider than the tracker: it includes hearings, letters, investigations, executive statements and the industry incidents that lawmakers cited, none of which are legislation. Every legislative item here also has a tracker entry, linked from the item. Items were checked against the official page where one exists; where a source blocks automated access the item says so and names what corroborated it. Where the summary supplied to this site named the wrong sponsor or number, the correction is shown.",
 "bottom": "No federal frontier-AI bill became law in September or the first week of October 2026. California's SB 813 and AB 1405 were the period's enacted measures. New York's S.10701 was withdrawn on introduction and Pennsylvania's H.B. 2800 is in committee. Every federal bill above remains at the referral stage; the administration's response so far is a voluntary accord, a terminology executive order and a task force with a 120-day report.",
 "kinds": {
  "federal": {
   "name": "Federal",
   "desc": "Congress: bills, letters, hearings, investigations",
   "color": "#1D57A5",
   "soft": "#E8F0FB"
  },
  "state": {
   "name": "State",
   "desc": "State legislatures, governors and attorneys general",
   "color": "#1B7F4C",
   "soft": "#E6F4EC"
  },
  "executive": {
   "name": "Federal executive",
   "desc": "White House and agencies",
   "color": "#B4691A",
   "soft": "#FBF0E3"
  },
  "litigation": {
   "name": "Litigation",
   "desc": "Courts",
   "color": "#7A3E9D",
   "soft": "#F2E9F7"
  },
  "industry": {
   "name": "Industry and incidents",
   "desc": "Company disclosures and events lawmakers cited; not government action",
   "color": "#5B6673",
   "soft": "#EEF1F4"
  }
 },
 "items": [
  {
   "date": "2026-09-03",
   "kind": "industry",
   "title": "OpenAI releases GPT-6 Astra, its first model rated \"Critical\" for cyber capability",
   "body": "OpenAI released GPT-6 Astra on Sept 3 and classified it as the first model to reach the Critical level of cybersecurity capability under its Preparedness Framework. Access was limited at launch to participants in OpenAI's Daybreak cybersecurity program and to enterprise workspaces that opt in. The rating was cited in later congressional statements as evidence that voluntary safeguards were no longer sufficient.",
   "links": [
    {
     "t": "OpenAI safety overview",
     "u": "https://openai.com/index/safety-overview-gpt-6-astra/"
    },
    {
     "t": "CNBC, Sept 3",
     "u": "https://www.cnbc.com/2026/09/03/open-ai-astra-gpt-6-cyber.html"
    },
    {
     "t": "CSO Online",
     "u": "https://www.csoonline.com/article/4218679/openai-launches-gpt-6-astra-its-first-model-to-cross-a-critical-cybersecurity-threshold.html"
    }
   ],
   "check": "OpenAI's page blocks automated access and was not opened; the release date and the Critical rating are corroborated by CNBC and CSO Online.",
   "tracker": null,
   "origin": "authored",
   "verification": {
    "method": "author",
    "checked_at": "2026-09-03T00:00:00Z"
   }
  },
  {
   "date": "2026-09-03",
   "kind": "federal",
   "title": "Sanders announces a Ban Artificial Superintelligence Act",
   "body": "Sen. Bernie Sanders and Rep. Greg Casar announced a forthcoming bill to prohibit artificial superintelligence and pause advanced-AI development until Congress creates binding rules. The bill was introduced on Sept 23 (S. 5493) and Sept 24 (H.R. 10538); see below.",
   "links": [
    {
     "t": "Sanders–Casar release, Sept 3",
     "u": "https://www.sanders.senate.gov/press-releases/news-sanders-casar-introduce-legislation-to-ban-artificial-superintelligence-and-temporarily-pause-advanced-ai-development/"
    }
   ],
   "check": "Release read. The summary supplied to this site linked a Sanders–Khanna release that no longer resolves; the co-lead in the House is Rep. Casar, with Rep. Khanna a cosponsor.",
   "tracker": "s-5493-h-r-10538-ban-artificial-superintelligence-act",
   "origin": "authored",
   "verification": {
    "method": "author",
    "checked_at": "2026-09-03T00:00:00Z"
   }
  },
  {
   "date": "2026-09-09",
   "kind": "industry",
   "title": "Anthropic researcher Jacob Coxon resigns with a public warning",
   "body": "Jacob Coxon, a pretraining researcher who had worked at OpenAI and then Anthropic, resigned in a widely shared post saying the leading labs were \"racing straight to self-improving superintelligence and gambling with our lives.\" Sen. Hawley's Sept 10 letter and later floor speeches cited the resignation and related statements by Anthropic researchers.",
   "links": [
    {
     "t": "TechCrunch, Sept 9",
     "u": "https://techcrunch.com/2026/09/09/gambling-with-our-lives-anthropic-researcher-quits-warns-against-self-improving-ai/"
    },
    {
     "t": "CNBC, Sept 9",
     "u": "https://www.cnbc.com/2026/09/09/anthropic-researcher-quits-ai-safety.html"
    }
   ],
   "check": "Reports dated Sept 9 (the summary supplied to this site said Sept 8); the AP link it gave blocks automated access and was replaced.",
   "tracker": null,
   "origin": "authored",
   "verification": {
    "method": "author",
    "checked_at": "2026-09-09T00:00:00Z"
   }
  },
  {
   "date": "2026-09-09",
   "kind": "state",
   "title": "California enacts SB 813 and AB 1405",
   "body": "Gov. Newsom signed SB 813 (certification framework for independent AI-verification organizations, Chapter 179) and AB 1405 (registration and integrity standards for AI auditors, Chapter 178). These are the only frontier-related measures enacted anywhere in the United States in September. The Governor's release also called on the federal government to adopt national regulation.",
   "links": [
    {
     "t": "Governor's release, Sept 9",
     "u": "https://www.gov.ca.gov/2026/09/09/governor-newsom-signs-first-in-the-nation-ai-safeguards-to-protect-californians-calls-on-the-federal-government-to-do-its-part/"
    }
   ],
   "check": "Release read. Chaptered texts not opened; see the tracker rows.",
   "tracker": "ca-sb-813-ivos",
   "origin": "authored",
   "verification": {
    "method": "author",
    "checked_at": "2026-09-09T00:00:00Z"
   }
  },
  {
   "date": "2026-09-10",
   "kind": "federal",
   "title": "Hawley opens an investigation into OpenAI over the Hugging Face incident",
   "body": "Sen. Josh Hawley, as chair of the Senate Homeland Security Subcommittee on Disaster Management, wrote to Sam Altman opening an investigation into OpenAI agents' July 2026 intrusion into Hugging Face \"in light of new, disturbing evidence,\" and into \"growing allegations of the existential risk of new AI products.\" The letter requests records and communications.",
   "links": [
    {
     "t": "Hawley release and letter, Sept 10",
     "u": "https://www.hawley.senate.gov/chairman-hawley-launches-investigation-into-openai-for-hacking-existential-risk-of-ai-products/"
    }
   ],
   "check": "Release read; dated Thursday, Sept 10.",
   "tracker": null,
   "origin": "authored",
   "verification": {
    "method": "author",
    "checked_at": "2026-09-10T00:00:00Z"
   }
  },
  {
   "date": "2026-09-11",
   "kind": "federal",
   "title": "House members ask Speaker Johnson to reconvene the House for AI safeguards",
   "body": "Reps. Sam Liccardo, Lori Trahan, George Whitesides and Ted Lieu released a letter urging the Speaker to reconvene the House and advance bipartisan safeguards for advanced AI, citing rogue agents, biological misuse, cyberattacks and foreign replication of US systems. It lists frontier-model transparency and evaluation mandates, \"kill switch\" requirements and an antitrust waiver for industry safety collaboration as options.",
   "links": [
    {
     "t": "Liccardo release, Sept 11",
     "u": "https://liccardo.house.gov/media/press-releases/lawmakers-urge-speaker-johnson-reconvene-house-advance-bipartisan-ai"
    }
   ],
   "check": "Release read.",
   "tracker": null,
   "origin": "authored",
   "verification": {
    "method": "author",
    "checked_at": "2026-09-11T00:00:00Z"
   }
  },
  {
   "date": "2026-09-11",
   "kind": "federal",
   "title": "Reuters: Senate negotiators weigh a federal \"duty of care\" and pre-release blocking authority",
   "body": "Reuters reported that Majority Leader Thune, Commerce Chair Cruz and Sen. Klobuchar were drafting legislation that would impose a duty of care on developers of the most capable models to prevent catastrophic risks, including nuclear and biological misuse, would let the federal government block the release of a model deemed unsafe subject to court challenge, and would preempt state regulation for certain risk categories. Klobuchar: \"I'm continuing to work toward a bipartisan agreement on legislation for government oversight of the greatest risks posed by AI models.\"",
   "links": [
    {
     "t": "Reuters via Investing.com, Sept 11",
     "u": "https://www.investing.com/news/stock-market-news/us-senate-negotiators-consider-requiring-ai-firms-to-mitigate-known-major-risks-4898357"
    }
   ],
   "check": "Article read. No text has been released; the tracker carries this as a draft in development.",
   "tracker": "senate-commerce-draft-cruz-klobuchar-thune",
   "origin": "authored",
   "verification": {
    "method": "author",
    "checked_at": "2026-09-11T00:00:00Z"
   }
  },
  {
   "date": "2026-09-12",
   "kind": "industry",
   "title": "Amodei publishes \"We Must Pace the Frontier\"; Altman matches the embedded-evaluator pledge",